CPic,Name,Country,City,Ppic,Bias,Heart,Date,Message1,Message
https://flagpedia.net/data/flags/w1160/tw.png,🎀,Taiwan,,ch0,Changhun,#6d8db7,,,엔티엑스의 존재는 행복입니다💗
https://flagcdn.com/w320/br.png,Bia,Brazil,Joao Pessoa- Brazil,ch1,Changhun,#6d8db7,2024-03-31,"NTX가 되어줘서 고마워요, 여러분은 제 인생과 하루하루를 밝게 만들어줘요. 항상 함께 있어 주세요, 사랑해요.","Thank you for being NTX, you brighten my life and my days, always stay together, I love you"
https://flagcdn.com/w320/jp.png,아카네,Japan,,ch2,Changhun,#6d8db7,2023-06-25,,"엔티엑스 4주년 축하해요오오오~!!
앞으로도 오래오래 화이팅 가자~🔥🔥🔥🔥🔥🔥🔥🔥"
https://flagcdn.com/w320/br.png,rayssa (레이사),Brazil,"São Luís-MA, Brasil",ch3,changhun,#6d8db7,2024-04-01,,"나는 인생에서 매우 섬세한 순간에 있었고 많은 일에 대해 매우 슬펐습니다... 친구들이 저에게 NTX를 소개해 주었고 NTX는 저의 일상에 빛과 같았습니다~~ NTX는 저에게 매일 동기를 부여하고 행복하게 해줍니다. 이렇게 훌륭하고 재능 있는 소년들의 팬이 된 것이 매우 자랑스럽습니다. 당신이 나를 행복하게 하듯 나도 당신을 행복하게 하기를 바랍니다🤟🏼🤟🏼 amo vocês, 우리는 끝까지 함께 할거야<3"
https://flagcdn.com/w320/jp.png,나미,Japan,japan,ch4,changhun,#6d8db7,2022-08-01,,"4th 축하해🎈 지금까지도, 앞으로도 계속 응원하고 있어😊"
https://flagcdn.com/w320/jp.png,에무,Japan,일본,ch5,changhun,#6d8db7,2020-10-01,,"NTX 여러분♡♡ 데뷔 4주년 축하해요🥳🥳 4년차도 모두가 하고 싶은 거 이룰 수 있기를. 항상 많이 노력해줘서 고마워요🥰 지금 이렇게 세계 여러 지역에서 공연을 할 수 있다는 게 너무 자랑스러워요☺️ 오랫동안 모두가 작은 기회를 착실히 잡아서 하나하나 하고 싶은 것을 이뤄가는 모습을 멀리서 지켜봐 온 것 같은데 정말 힘을 받고 있어요🥹 NTX는 나에게 있어서 멋진 음악을 해주는 자랑스러운 팀이고, 8명 모두가 소중한 보물이에요☺️ 앞으로도 전 세계 많은 분들에게 사랑받는 팀으로 높이 날아보자!!"
https://flagcdn.com/w320/jp.png,Miki,Japan,Japan,ch6,changhun,#6d8db7,2024-03-01,,NTX가 나의 행복🍀살아가는 힘💪🏻웃는 얼굴의 근원 🫶🏻내 앞에 나타나줘서 고마워✌🏻앞으로도 열심히 따라갈게🫡ㅎㅎ
https://flagcdn.com/w320/br.png,Thercyo,Brazil,"Campina Grande, Brazil 🇧🇷",ch7,Changhun & Hyeongjin,#EE2424,2024-06-01,"데뷔 4주년 축하해요, NTX! 여러분은 정말 많이 성장했어요, 매일매일 더 많은 것을 이루는 여러분을 보게 되어 너무 행복해요! 항상 여러분의 마음을 행복으로 채울 좋은 일이 있기를 바래요. 언제나 제 응원을 받을 수 있어요! 🤍 브라질에서 사랑을 보냅니다.","Happy 4th anniversary, NTX! You've grown so much, and I'm so happy to see you accomplishing more and more every day! I hope you'll always have something good to fill your hearts with happiness. You can always count on my support! 🤍 Love from Brazil."
https://flagcdn.com/w320/gb-sct.png,LexiLouWho,Scotland,"Edinburgh, Scotland",chheh,"Hojun, Eunho, & Changhun",#EE2424,2023-02-01,"내 사랑들!! 나는 정말로 여러분이 자랑스럽습니다! 매일매일 나를 감동시키고, 여러분의 창의적인 천재성이 발휘되는 모습을 보는 것이 너무 좋아요! 전 세계에서 점점 더 많은 사람들이 여러분을 사랑하게 되어 기쁘지만, 영국에 올 거라는 약속을 잊지 않을 거예요! ;) 다가오는 무대를 기다리고 있고, 여러분 각각이 앞으로 어떤 모습을 보여줄지 너무 기대돼요!! 정말 너무너무 사랑해요! 기념일 축하해요, 내 사랑들! ❤️Lexi","My loves!! I am so immensely proud of you! You continue to impress me daily, and I always love to see your creative genius at work! I’m so happy that more and more people around the world are falling in love with you guys, but I won’t forget your promise to me that you will come to the UK! ;) I can’t wait to see your upcoming stages and I’m excited to see what’s next for each and every one of you!! Love you so incredibly much! Happy anniversary my darlings! ❤️Lexi"
https://flagcdn.com/w320/br.png,Let,Brazil,João Pessoa - Paraíba,eh1,Eunho,#976a9a,2023-02-01,"소중한 나의 NTX에게, 정말 많이 사랑하고, 이렇게 함께 생일을 보낼 수 있어 감사해요. 앞으로도 많은 년 동안 함께할 수 있기를 바라요. 곧 만나요 ♥️","To my dear NTX who is so precious, I love you so much and I thank you for spending this birthday together and may we be together for many years, see you soon ♥️"
https://flagpedia.net/data/flags/w1160/sg.png,RIQA,Singapore,Singapore,eh2,Eunho,#976a9a,2023-05-16,"NTX가 제 삶에 있다는 것은 정말 축복받고 행복하다는 느낌을 줍니다. 그들에겐 뭔가가 있어서 점점 더 알고 싶어지게 만듭니다. 그들이 우리 NTFUL을 위해 해주는 모든 것들에 정말 감사해요—그들의 앨범, SoundCloud 트랙, YouTube 커버, 그리고 Bubble에서 전하는 진심 어린 메시지들. 그들의 음악은 기쁨, 위로, 그리고 영감을 줍니다. NTX, 열정과 노력에 감사드려요. 우리 NTFUL은 언제나 여러분을 진심으로 응원할 거예요!","Having NTX in my life makes me feel truly blessed and happy. Something about them draws me in, making me want to know more and more. I’m so grateful for everything they do for us, NTFULs—their albums, SoundCloud tracks, YouTube covers, and heartfelt messages on Bubble. Their music brings joy, comfort, and inspiration. Thank you, NTX, for your passion and hard work. We, NTFULs, will always support you with all our hearts!"
https://flagcdn.com/w320/br.png,viih!,Brazil,"Rio de Janeiro, Brasil",eh3,Eunho,#976a9a,2021-12-01,"여러분은 저의 영감이에요. 처음 여러분을 봤을 때, 정말 마법 같았어요. 가까이에서 여러분을 보고, 목소리를 들을 수 있어 영광이었어요... 정말 마법 같았어요. 여러분이 존재해줘서 너무 감사해요! 사랑해요!","Vocês são a minha inspiração, na primeira vez que vi vocês, foi mágico, me senti ornada em conseguir ver vocês de perto, ouvir a voz de vocês..... Foi magico, agradeço muito por vocês existirem! eu amo vocês!"
https://flagcdn.com/w320/jp.png,bbaneyan,Japan,일본,eh4,eunho,#976a9a,2022-09-01,,항상 응원하게 해줘서 고마워♡ 앞으로도 함께 하자~!! 사랑해~♡♡
https://flagcdn.com/w320/jp.png,나오,Japan,일본,eh5,eunho,#976a9a,,,"사랑하는 엔티엑스 4주년 축하해요~!! 항상 나의 피곤할때의 힐링으로, 헤맬때 이끌어주는 빛으로, 노력하는 용기가 되어주어서 고마워요♡ 영원이라는 말은 믿지 않았지만, 엔티엑스라고 한다면 믿어보고 싶고, 영원히 함께 하고 싶다고 생각해요 우리 서로를 사랑하고 격려하며 세계가 부러워하는 아이돌과 팬이 되자꾸나~!!"
https://flagcdn.com/w320/jp.png,슈리,Japan,일본,eh6,eunho,#976a9a,2023-07-01,,4주년 축하해! 모두가 위를 보고 열심히 하는 것을 보고 저도 힘을 얻고 있습니다! 항상 NTFUL에 사랑을 전해줘서 고마워요🩷지난 1년도 세계를 누비면서 Kiss the World 하세요💋 건강이 제일이고 함께 걸어요~난쿠루나이싸〜
https://flagcdn.com/w320/jp.png,이오리,Japan,"日本、大阪 （Japan,Osaka）",eh7,eunho,#976a9a,2024-11-01,4주년 축하합니다!!! NTX를 만난 이후로 제 매일이 정말 행복하고 즐겁습니다 ♡♡ 항상 멋진 퍼포먼스를 우리에게 보여줘서 감사합니다!! 또한 아이돌로 오랫동안 활동하는 것은 쉬운 일이 아닌데 이렇게 몇 년 동안 아이돌로 있어줘서 감사합니다 ♡! 만나줘서 고마워요! 모두 좋아해요~^^,4周年おめでとうございます！！！NTXと出会ってから私の毎日はすごく幸せで楽しいです♡♡いつも素敵なパフォーマンスを私たちに届けてくださってありがとうございます！！また、アイドルを長く続けることは簡単では無いのにこうして何年もアイドルでいてくれてありがとうございます♡！ 만나주어서 고마워요！ 모두 좋아해요~^^*
https://flagcdn.com/w320/tn.png,포루밍 🎈,Tunisia,튀니지,ftmm,hyeongjin xiha,#EE2424,2024-12-24,,"늦덕이라서 아쉬운 마음도 있지만, 이제라도 너희를 알게 되어 이렇게 많은 추억을 쌓을 수 있다는 게 정말 큰 행운이라고 생각해! 그리고 4주년을 함께할 수 있어서 너무 행복해. 앞으로 다가올 5주년, 6주년, 10주년, 그리고 100주년까지도 함께하자! 그동안 정말 너무 잘해왔고, 앞으로도 보여줄 모습들이 기대돼. 항상 응원할 테니까 끝까지 함께 달려보자! 우리 멋지고 소중한 아가들, 4주년 진심으로 축하하고 많이 많이 사랑해! 🫶"
https://flagcdn.com/w320/nz.png,Chels,New Zealand,New Zealand,h1,Hojun and Seungwon,#EE2424,2023-11-01,4주년 축하해요! 💗 비 오는 날 내 햇살이 되어줘서 고마워요 ☀️ 앞으로도 함께 많은 시간을 보낼 수 있기를 바랍니다. 항상 행복하고 건강하세요. 모두 사랑해요 💗,Happy 4th Anniversary! 💗 Thank you for being my sunshine on a rainy day ☀️ I hope we can spend many more years together. Always be happy and healthy. Love you all 💗
https://flagcdn.com/w320/jp.png,치카치카,Japan,일본,h10,Hojun,#81c3ad,2022-09-01,,NTFUL 4주년 축하해요! 항상 엔티플에게 행복을 고마워요😌앞으로도 열심히 응원할게요~!
https://flagcdn.com/w320/br.png,Ana Yasmine,Brazil,"Minas Gerais, Brazil",h11,Hojun,#81c3ad,2024-06-02,,"엔티엑스 데뷔 기념일 축하해요! 처음부터 함께하지는 못했지만, 작년에 여러분을 알게 되고 팬이 될 수 있어서 정말 행복해요. 항상 열심히 해줘서 고맙고, 멋진 음악을 만들어줘서 감사해요. 엔티엑스와 함께하는 모든 순간이 특별하고, 앞으로도 오랫동안 응원하고 싶어요. 이번 새로운 해에도 더 많은 행복과 성공이 있기를 바랍니다! 사랑해요!"
https://flagcdn.com/w320/bg.png,Dariya,Bulgaria,Bulgaria,h12,Hojun/Hyeongjin,#EE2424,2023-01-01,"NTX 알게 되어 정말 행복해요. 열심히 일해주고 여러분의 예술성을 보여줘서 고마워요! 진정한 올라운더들이에요!! 여러분을 직접 만나게 되어 너무 기쁘고, 항상 친절하고 배려해줘서 고마워요. NTFUL이 되어 자랑스러워요❣️ 유럽에서 여러분을 볼 수 있기를 바라며, 건강을 잘 챙기고 절대 그 빛을 잃지 않기를 바래요","I'm so happy to know you. Thank you for working hard and showing us your artistry! You are truly all-rounders!! I feel so blessed to have met you in person, thank you for always being kind and considerate. I'm proud to be an NTFUL❣️ I hope I can see you in Europe, stay healthy & never lose your spark!"
https://flagcdn.com/w320/br.png,duda,Brazil,"João Pessoa., Brasil",h2,Hojun,#81c3ad,2023-12-01,"축하해요, 남자들! 언제나 브라질에 돌아와 주세요, 우리는 항상 두 팔 벌려 여러분을 기다릴게요 <3<3","Parabéns meninos, voltem sempre ao Brasil, estaremos sempre de braços abertos <3<3"
https://flagcdn.com/w320/br.png,Lauralima0613,Brazil,Belo Horizonte Brazil,h3,Hojun,#81c3ad,,,"안녕하세요 NTX. 열심히 노력해주셔서 감사합니다. 4년이 지났는데 정말 잘 해내셨습니다. 시간이 정말 빨리 흐르죠? 여러분이 이 아름다운 여정을 즐기시기 바랍니다. 여러분은 함께 성장하고, 우리는 여러분과 함께 걷고 있습니다. 세상 반대편에서 당신을 생각하고 응원하는 사람들이 있다고 해서 외로움을 느끼지 마세요. 우리를 잊지 말고, NTFul을 생각하며 건강을 잘 챙기세요. 당신이 없었다면 우리는 존재할 수 없었을 것입니다. 정말 감사하고, 당신을 사랑합니다. 앞으로 오랜 세월 당신과 함께 할 수 있기를. 나는 당신을 매우, 매우, 매우, 매우 사랑합니다."
https://flagcdn.com/w320/jp.png,mayu,Japan,日本 千葉県,h4,Hojun,#81c3ad,2023-08-01,"NTX의 행복은 NTFUL의 행복이며, 그것은 내 행복으로 이어집니다. 그리고 그로부터 많은 행복한 순간들이 태어납니다. NTX와 NTFUL 여러분, 행복을 감사합니다 🫶",NTXの幸せはNTFULの幸せであり、私の幸せにつながります。そしてそこからたくさんのHappyが生まれてます NTX、NTFULの皆さん、幸せをありがとうございます🫶
https://flagcdn.com/w320/us.png,조지 🍀,USA,USA,h5,Hojun,#81c3ad,2024-07-24,,"NTX 4주년 축하해용~! 저 아직 250일 정도밖에 안 됐지만, 벌써 많은 일들이 있었고 함께한 모든 순간에 항상 감사해요~~ 앞으로 더 많은 시간을 같이 보낼 수 있으면 좋겠어용~ 어디서든 항상 응원할게요!! 사랑해요~ 우리 꼭 다시 만나자!!"
https://flagcdn.com/w320/de.png,citty,Germany,Germany,h6,hojun,#81c3ad,2023-02-01,,"10년 동안 나는 K-Pop 팬이었지만, 그 시간 중 최고의 순간은 지난 2년이었어, 내가 NTFUL이 되었을 때.🖤 NTX👏세계👏지배~🤟😝🔥😌🍸4주년 축하해~🥳🥂"
https://flagcdn.com/w320/br.png,Nara,Brazil,Salvador Bahia,h7,Hojun,#81c3ad,2025-02-01,"저를 SOS로 삼아줘서 고마워요, 아무도 저를 보지 않았을 때 여러분이 저를 찾아줬어요. 이 힘이 서로에게 돌아가기를 바래요, 여러분은 원하는 모든 것을 이룰 수 있어요, 우리는 항상 함께 할 거예요. 감사합니다.","Obrigado por terem se tornado o meu SOS , quando ninguém mas me via vocês me encontraram e espero que essa força seja recíproca , vocês conseguem tudo que quererem , estaremos sempre juntos . 감사합니다"
https://flagcdn.com/w320/br.png,라리🤟,Brazil,브라질,h8,Hojun,#81c3ad,2021-04-01,"데뷔 4주년 축하해요!! 여러분의 노력에 감사하고, 제 하루하루를 더 행복하게 만들어줘서 고마워요, 정말 대단해요! 제가 좋아하는 멋진 아이들과 많은 시간을 함께 보내고 싶어요!! 💕🤟💕","Happy 4th birthday!! I'm grateful for your hard work and for making my days happier, you guys are amazing! I want to spend many years with my favorite boys!! 💕🤟💕"
https://flagcdn.com/w320/us.png,쇼유,USA,"California, USA",h9,Hojun,#81c3ad,2025-08-01,데뷔 4주년 축하해요~!! 항상 행복을 선물해줘서 고마워요. 앞으로도 함께 행복하게 지내요 :),데뷔 4주년 축하해요~!! Thank you for all the happiness & let’s stay happy :)
https://flagcdn.com/w320/id.png,Rara,Indonesia,Indonesia,heh,Hyeongjin Hojun Eunho,#EE2424,2023-03-01,"NTX 4주년 축하해요 🖤 NTFUL~ 매일 웃게 해줘서 고마워요. NTFUL의 일원이 되어 행복해요 ٩(ˊᗜˋ)و ~ NTX가 앞으로도 더 밝게 빛나기를 바라고, 우리 함께 큰이고 강한 팬덤을 만들어 가요!",Happy Anniversary NTX 🖤 NTFUL~ Thank you for making me smile every day. I'm happy being a part of NTFUL ٩(ˊᗜˋ)و ~ may NTX continue to shine even brighter in the years to come and Let's make a big and strong fandom
https://flagcdn.com/w320/br.png,Nabi vt,Brazil,Brasil,hj1,Hyeongjin,#ebe9e9,2023-04-01,"각 멤버의 가장 깊은 소원이 모두 이루어지길 바랍니다. 저는 여기에서 여러분을 응원하고, 매일 더 많은 성공을 거두고 그룹으로서, 그리고 개인적으로 놀라운 일들을 이루길 기도할게요. NTX는 세상의 모든 사랑을 받을 자격이 있어요. 제 하루하루를 더 행복하게 만들어줘서 감사합니다. 사랑해요, NTX ❤️",Espero que todos os desejos mais profundos de cada membro se realizem. Estarei aqui os apoiando e torcendo para que cada dia tenham mais sucesso e conquistem coisas incríveis como grupo e individualmente. O NTX merece todo o amor do mundo. Obrigada por fazerem meus dias mais felizes. TE AMO NTX ❤️
https://flagcdn.com/w320/jp.png,Y,Japan,일본,hj10,hyeongjin,#ebe9e9,2022-09-01,,오래오래 함께하자~🤍
https://flagcdn.com/w320/jp.png,보조개누나,Japan,JAPAN,hj11,hyeongjin,#ebe9e9,2022-08-01,,엔티엑스 4주년 축하해~~!벌써 4주년이라니! 이제 데뷔 기념일을 축하하는건 3번째가 되는데 지금까지 함께할 수 있어서 너무 좋았고 앞으로도 그럴거니까 우리 앞으로 더더 좋은 추억을 쌓아가자🤍 다음에 5주년을 맞이할 땐 우리 서로가 지금까지보다 행복했다고 느낄 수 있는 그런 한해를 보내자~! 항상 노력해줘서 고맙고 사랑해!🤍🤍🤍🤍
https://flagcdn.com/w320/jp.png,이요짱,Japan,名古屋,hj12,hyeongjin,#ebe9e9,2024-11-01,데뷔 4주년 축하해요 🥹💕 항상 많은 행복을 줘서 고마워요 ✨ 앞으로도 계속 함께 있어요!!,デビュー4周年おめでとう🥹💕 いつも沢山の幸せをくれてありがとう✨ これからもずっと一緒にいようね！！
https://flagpedia.net/data/flags/w1160/tw.png,나비🦋,Taiwan,TAIWAN,hj13,hyeongjin,#ebe9e9,2024-04-01,,엔티엑스 와썹~ 나비입니당~ㅎㅎㅎ 어느덧 NTFUL이 된 지 1년이 지났네요! 시간이 참 빠르다~ 한 해 동안 NTX 덕분에 새로운 것들을 많이 경험했습니다! 많은 추억이 쌓였고 힘든 부분도 많았지만 NTX를 보는 순간 그런 것들은 중요하지 않은 것 같아요! 항상 최선을 다해 멋진 무대를 보여 줄 NTX! 정말정말 좋아해! 우리 오래오래 함께합시다! 4주년 많이많이 축하행!! 사랑해!!
https://flagcdn.com/w320/us.png,britt,USA,,hj14,Hyeongjin,#ebe9e9,,,"이제 너도 알겠지만, 네가 내 인생을 얼마나 바꿔놓았는지 몰라. 단 2년 만에 너는 나에게 가장 소중한 8명의 사람 중 한 명이 되었어. 네가 내 가장 힘든 날들에 항상 내 곁에 있어 주었고, 내가 말했든 말하지 않았든 네 존재만으로도 계속 나아갈 힘을 주었어. 네가 이 길을 걷기로 한 지 4년이 지났다는 게 믿기지 않을 정도로 시간이 빠르게 흘렀어. 너는 네가 얼마나 멀리 왔는지 되돌아볼 시간조차 내지 않지만, 멈춰 서서 바라보면 네가 얼마나 많이 성장했는지 알 수 있어. 너는 전 세계 수많은 사람들을 한데 모았고, 나와 많은 이들에게 영원히 소중히 여길 우정을 선물해줬어. 너는 각자의 정체성을 확립하면서도 그 어느 때보다 하나로 단합된 모습을 보여줬어. 2021년부터 지금까지 너와 함께하며 네가 성장하는 모습을 볼 수 있었던 것은 내게 큰 축복이었고, 앞으로 네가 어디로 나아갈지 너무나 기대돼. 언제나 네 곁에 있을게. 이것이 내 인생을 위한 이 ntful한 메시지야"
https://flagcdn.com/w320/id.png,sha,Indonesia,"Indonesia, Bandung (e)",hj15,"Hyeongjin, Rawhyun, Xiha",#EE2424,2023-05-09,"4주년 축하해요, NTX 🥳 항상 여기 있어줘서 고마워요. 여러분이 이 여정을 시작한 지 4년이 넘었고, 이제 NTFUL은 이 여정을 함께 걸어갈 거예요. 아마 여러분이 한 번도 본 적 없고, 목소리도 들어본 적 없는 NTFUL일 수도 있지만, 저는 여전히 진심으로 항상 여러분을 응원할 NTFUL이에요~","Happy 4th anniversary, NTX 🥳 Thank you for staying here always. It's been more than 4 years since you started this journey, and now, NTFUL will also stay along by your side through this journey together. I may be an NTFUL whos face you haven't ever seen or voice you haven't ever heard, but I'm still an NTFUL who will sincerly always support you ~"
https://flagcdn.com/w320/lv.png,AE,Latvia,"Riga, Latvia",hj2,Hyeongjin,#EE2424,2023-11-01,"안녕~ 4년은 긴 시간이야! 돌아보면 얼마나 자랑스럽다고 느껴져? 나는 그렇다고 생각해! 내가 좋아하는 사람들에 대해 자랑하는 나쁜 습관이 있어. “그들이 이걸 했다는 거 알아? 저걸 했다는 거 알아?”~ NTX에 대해 자랑할 수 있는 일이 백 가지는 있어. 너희를 따라가는 것이 정말 기뻤어. 작은 행복도 있었고, 큰 행복도 있었어. 슬픔도 마찬가지였고. 그 모든 것들이 내 삶에 가치를 더해주었어, 기쁨이든, 연민이든. 모든 것에 감사해! 뭐가 있든 계속 나아가자~ 자랑과 사랑을 담아서, AE","hi hi~ four years is a long time! do you feel proud when you look back and see how far you’ve come? I do! I have a bad habit of bragging about the people I like. “Did you know they did this? Did you know they did that?”~ there’s a hundred things I can brag about when I speak of NTX. it’s been a pleasure to follow you. I’ve seen small happinesses and I’ve seen big ones. and same goes for sadnesses. they’ve all added value to my life, whether it’s joy or compassion. thank you for everything! let’s keep going no matter what~ with a lot of pride and love, AE"
https://flagcdn.com/w320/br.png,Apollo,Brazil,"Brasília, Brasil",hj3,Hyeongjin,#ebe9e9,2023-12-01,"안녕하세요 NTX, 그룹의 데뷔 4주년이 왔네요. 4년간의 헌신과 팬들을 향한 사랑, 그리고 항상 노래를 통해 저희에게 모든 걸 주셔서 감사해요. 여러분 한 사람 한 사람에게 감사드리고, 저를 웃게 해주고 살아있다는 걸 느끼게 해줘서 고마워요. 가장 필요할 때 제 인생에 나타나줘서 고마워요. 모두 정말 많이 사랑하고, 브라질에서 여러분을 기다리고 있을게요 <3","Hello NTX, the group's 4th anniversary is here, 4 years of dedication, love for the fans and always giving everything to us through the songs. I just have to thank each and every one of you for making me smile and feel alive, thank you for appearing in my life when I needed it most. I love you all very much and I'm eagerly waiting for you here in Brazil <3"
https://flagcdn.com/w320/br.png,Bianca Amorim,Brazil,"Campina Grande, Paraíba - Brasil",hj4,Hyeongjin,#ebe9e9,2023-02-01,"러분 덕분에 제가 평생 간직할 추억을 만들고, 소중한 친구들도 만났어요! 여러분이 제 삶에 와줘서 항상 감사해요, 앞으로도 오래도록 함께해요! 여러분을 사랑해요 🤍🩵","Thanks to you I created memories and made friendships I’ll cherish forever! Always grateful you guys came into my life, let’s continue together for a long time! Eu amo vocês 🤍🩵"
https://flagcdn.com/w320/cn.png,Debbie,China,"Shanxi, China",hj5,Hyeongjin,#ebe9e9,2023-03-15,"제 인생의 힘든 시기에 여러분의 음악, 웃음, 그리고 공연이 저에게 많은 힘을 주었어요. 여러분이 꿈을 위해 열심히 노력하는 모습을 보면서 저도 더 나은 사람이 되고 싶다는 생각을 했어요. 데뷔 4주년 축하해요! 100주년까지 함께 걸어가요!","During the challenging times in my life, your music, your smiles, and your performance gave me so much strength. Seeing how hard you work for your dreams makes me want to become a better version of myself. Happy 4th anniversary! Let’s walk together all the way to the 100th anniversary!"
https://flagcdn.com/w320/br.png,gabi,Brazil,Brasil,hj6,Hyeongjin,#ebe9e9,2024-06-01,"NTX 만나서 너무 행복하고 매일 더 행복하게 만들어줘요. 여러분의 음악, 멤버들, 팬들에 대한 사랑이 너무 좋아요. 항상 계속해서 여러분을 응원할 거예요! 우리와 함께 있어줘서 고마워요. 사랑해요, 데뷔 기념일 축하해요!""","NTX, I'm so happy to have met you guys and you make me happier every day. I love your music, the members and your love for your fans. I will continue to follow you always! Thank you for staying with us. I love you and happy debut anniversary!"
https://flagcdn.com/w320/us.png,타치마,USA,미국,hj7,hyeongjin,#ebe9e9,2023-09-13,,아주 오래 오래 함께 하자 사랑해!
https://flagcdn.com/w320/pt.png,나나,Portugal,"Lisbon, Portugal",hj8,hyeongjin,#ebe9e9,2023-06-09,,울 엔티엑스.. 과거를 돌아보며 함께 얼마나 성장했는지 서로의 곁을 놓지 않고 이렇게 걸어온 시간이 정말 소중해.. 좋은 아이돌은 좋은 팬을 만든다니까 오늘 같은 날 이렇게 다 함께 있다는 게 정말 행복해!! 태어난 것도 감사하고 앞으로도 두려움 없이 함께 할 우리에게 진심으로 고마워!
https://flagcdn.com/w320/jp.png,아키콩,Japan,Japan Tokyo,hj9,hyeongjin,#ebe9e9,2023-10-01,,데뷔 4주년 축하해요！ NTFUL이 되서 정말 행복해요🫶🏻‎ 앞으러도 오래오래 같이 가자～Skrr❣️
