CPic,Name,Country,City,Ppic,Bias,Heart,Date,Message1,Message
https://flagcdn.com/w320/jp.png,U,Japan,"히로시마,일본",yh8,hyeok,#c24a8d,11/1/2024,"4주년 정말 축하해~! NTFUL이 된지 아직 얼마 되지 않았지만, 이 기간에도 이렇게 많은 사랑을 받고 NTFUL이 될 수 있어서 행복합니다!! 좀더 빨리 너희들을 만나고 싶었어요🥲 그렇지만! 그동안의 여유시간만큼 앞으로 많이 사랑을 전하고 응원할께요~! 항상 NTFUL 에 많은 사랑을 줘서 고마워요 앞으로도 사랑합니다🫶","4주년 정말 축하해~! NTFUL이 된지 아직 얼마 되지 않았지만, 이 기간에도 이렇게 많은 사랑을 받고 NTFUL이 될 수 있어서 행복합니다!! 좀더 빨리 너희들을 만나고 싶었어요🥲 그렇지만! 그동안의 여유시간만큼 앞으로 많이 사랑을 전하고 응원할께요~! 항상 NTFUL 에 많은 사랑을 줘서 고마워요 앞으로도 사랑합니다🫶"
https://flagcdn.com/w320/jp.png,이오리,Japan,"日本、大阪 （Japan,Osaka）",eh7,eunho,#976a9a,11/1/2024,,4周年おめでとうございます！！！NTXと出会ってから私の毎日はすごく幸せで楽しいです♡♡いつも素敵なパフォーマンスを私たちに届けてくださってありがとうございます！！また、アイドルを長く続けることは簡単では無いのにこうして何年もアイドルでいてくれてありがとうございます♡！ 만나주어서 고마워요！ 모두 좋아해요~^^*
https://flagcdn.com/w320/jp.png,이요짱,Japan,名古屋,hj12,hyeongjin,#ebe9e9,11/1/2024,,デビュー4周年おめでとう🥹💕 いつも沢山の幸せをくれてありがとう✨ これからもずっと一緒にいようね！！
https://flagcdn.com/w320/br.png,bru,Brazil,Brasil,rw4,rawhyun,#a5bd5e,11/7/2024,,"NTFULS에게 주신 모든 사랑과 기회에 감사드립니다. 당신은 최선을 다할 자격이 있기 때문에 당신의 꿈이 점점 더 이루어지기를 바랍니다. 우리가 다른 많은 생일을 함께 보내길, 사랑해! 🤍"
https://flagcdn.com/w320/sa.png,Rue,Saudi Arabia,"Riyadh, Saudi Arabia",yh4,hyeok,#c24a8d,12/1/2024,,Congratulations on your 4th anniversary. Finding you and becoming your fan was one of the best decisions I ever made. Thank you for the amazing music and talent. I love you!
https://flagcdn.com/w320/tn.png,포루밍 🎈,Tunisia,튀니지,ftmm,hyeongjin xiha,#EE2424,12/24/2024,"늦덕이라서 아쉬운 마음도 있지만, 이제라도 너희를 알게 되어 이렇게 많은 추억을 쌓을 수 있다는 게 정말 큰 행운이라고 생각해! 그리고 4주년을 함께할 수 있어서 너무 행복해. 앞으로 다가올 5주년, 6주년, 10주년, 그리고 100주년까지도 함께하자! 그동안 정말 너무 잘해왔고, 앞으로도 보여줄 모습들이 기대돼. 항상 응원할 테니까 끝까지 함께 달려보자! 우리 멋지고 소중한 아가들, 4주년 진심으로 축하하고 많이 많이 사랑해! 🫶","늦덕이라서 아쉬운 마음도 있지만, 이제라도 너희를 알게 되어 이렇게 많은 추억을 쌓을 수 있다는 게 정말 큰 행운이라고 생각해! 그리고 4주년을 함께할 수 있어서 너무 행복해. 앞으로 다가올 5주년, 6주년, 10주년, 그리고 100주년까지도 함께하자! 그동안 정말 너무 잘해왔고, 앞으로도 보여줄 모습들이 기대돼. 항상 응원할 테니까 끝까지 함께 달려보자! 우리 멋지고 소중한 아가들, 4주년 진심으로 축하하고 많이 많이 사랑해! 🫶"
https://flagcdn.com/w320/cn.png,knt,China,中国山东青岛🇨🇳,ntx10,8,#EE2424,1/1/2025,,亲爱的NTX 男同学们 你们好 今天是你们出道的四周年！祝贺你们！🎉🎉我在今年二月刚刚入坑 开始了解你们 看你们的物料 也看了peaktime 你们好棒！我看到了你们的努力💪🏻 很幸运可以认识你们 这次回归新专的每一首都很好听！看到这次专辑大卖了这么多本我真的好感动😭而且这次回归成员们的服装 配合也都很棒～请继续坚持下去好吗！！中国NTFUL与你们同在 会继续陪伴支持你们 怀挺！！请走花路吧！🌸我爱你们 HAPPY NTX DAY！🥹🫶
https://flagcdn.com/w320/br.png,Nara,Brazil,Salvador Bahia,h7,Hojun,#81c3ad,2/1/2025,,"Obrigado por terem se tornado o meu SOS , quando ninguém mas me via vocês me encontraram e espero que essa força seja recíproca , vocês conseguem tudo que quererem , estaremos sempre juntos . 감사합니다"
https://flagcdn.com/w320/ca.png,Harsh,Canada,Canada,ntx8,8,#EE2424,3/1/2025,,"Thank you for working so hard from debut, I'm so happy to have discovered your music! The new album and past ones are so good, you guys are amazing. Your vocals, dance, and live performances are so energetic and amazing! I hope you all stay healthy and happy (and I hope to see you live one day!). 💗♾️💗"
https://flagcdn.com/w320/br.png,Sarah,Brazil,"Brazil, Goiás, Goiânia",rw10,Rawhyun,#a5bd5e,3/28/2025,,"NTX, i love you all very much! I wish all the best for this wonderful group and I am so excited to see you guys in june 28 in Goiânia! Thanks so much for your hard work, NTX!"
https://flagcdn.com/w320/us.png,쇼유,USA,"California, USA",h9,Hojun,#81c3ad,8/1/2025,데뷔 4주년 축하해요~!! Thank you for all the happiness & let’s stay happy :),데뷔 4주년 축하해요~!! Thank you for all the happiness & let’s stay happy :)
https://flagcdn.com/w320/us.png,타치마,USA,미국,hj7,hyeongjin,#ebe9e9,sept 13 2023,아주 오래 오래 함께 하자 사랑해!,아주 오래 오래 함께 하자 사랑해!
https://flagcdn.com/w320/kr.png,마루,Korea,부산,xh9,xiha,#e06e3c,sept 2023,엔티엑스를 만나고 지금까지 힘들때도 기쁠때도 함께 해주셔서 감사해요.앞으로도 사랑해요！,엔티엑스를 만나고 지금까지 힘들때도 기쁠때도 함께 해주셔서 감사해요.앞으로도 사랑해요！
https://flagpedia.net/data/flags/w1160/tw.png,🎀,Taiwan,,ch0,Changhun,#6d8db7,,엔티엑스의 존재는 행복입니다💗,엔티엑스의 존재는 행복입니다💗
https://flagcdn.com/w320/my.png,Ann,Malaysia,"Kuala Lumpur, Malaysia",rw21,Rawhyun 🫶🏻 OT8,#a5bd5e,,,"Thank you for becoming an idol! Because of you, I got to meet you all like this. I always feel so happy when I see you! Everyone is so amazing, so talented, and works so hard—it’s really incredible. Thanks to you, I’ve learned to love myself more and want to keep improving what I need to. I love NTX so, so much! Happy 4th anniversary🩷 Let’s keep growing together and cheering each other on for a long, long time! Let’s go~!!"
https://flagcdn.com/w320/us.png,britt,USA,,hj14,Hyeongjin,#ebe9e9,,"이제 너도 알겠지만, 네가 내 인생을 얼마나 바꿔놓았는지 몰라. 단 2년 만에 너는 나에게 가장 소중한 8명의 사람 중 한 명이 되었어. 네가 내 가장 힘든 날들에 항상 내 곁에 있어 주었고, 내가 말했든 말하지 않았든 네 존재만으로도 계속 나아갈 힘을 주었어. 네가 이 길을 걷기로 한 지 4년이 지났다는 게 믿기지 않을 정도로 시간이 빠르게 흘렀어. 너는 네가 얼마나 멀리 왔는지 되돌아볼 시간조차 내지 않지만, 멈춰 서서 바라보면 네가 얼마나 많이 성장했는지 알 수 있어. 너는 전 세계 수많은 사람들을 한데 모았고, 나와 많은 이들에게 영원히 소중히 여길 우정을 선물해줬어. 너는 각자의 정체성을 확립하면서도 그 어느 때보다 하나로 단합된 모습을 보여줬어. 2021년부터 지금까지 너와 함께하며 네가 성장하는 모습을 볼 수 있었던 것은 내게 큰 축복이었고, 앞으로 네가 어디로 나아갈지 너무나 기대돼. 언제나 네 곁에 있을게. 이것이 내 인생을 위한 이 ntful한 메시지야","이제 너도 알겠지만, 네가 내 인생을 얼마나 바꿔놓았는지 몰라. 단 2년 만에 너는 나에게 가장 소중한 8명의 사람 중 한 명이 되었어. 네가 내 가장 힘든 날들에 항상 내 곁에 있어 주었고, 내가 말했든 말하지 않았든 네 존재만으로도 계속 나아갈 힘을 주었어. 네가 이 길을 걷기로 한 지 4년이 지났다는 게 믿기지 않을 정도로 시간이 빠르게 흘렀어. 너는 네가 얼마나 멀리 왔는지 되돌아볼 시간조차 내지 않지만, 멈춰 서서 바라보면 네가 얼마나 많이 성장했는지 알 수 있어. 너는 전 세계 수많은 사람들을 한데 모았고, 나와 많은 이들에게 영원히 소중히 여길 우정을 선물해줬어. 너는 각자의 정체성을 확립하면서도 그 어느 때보다 하나로 단합된 모습을 보여줬어. 2021년부터 지금까지 너와 함께하며 네가 성장하는 모습을 볼 수 있었던 것은 내게 큰 축복이었고, 앞으로 네가 어디로 나아갈지 너무나 기대돼. 언제나 네 곁에 있을게. 이것이 내 인생을 위한 이 ntful한 메시지야"
https://flagcdn.com/w320/jp.png,아나아나,Japan,일본,rw1,raw,#a5bd5e,,4주년 정말 축하드려요‼︎ 언제나 멋진 무대를 보여주는 NTX가 너무 좋아요‼︎ 앞으로도 계속 응원하겠습니다‼︎,4주년 정말 축하드려요‼︎ 언제나 멋진 무대를 보여주는 NTX가 너무 좋아요‼︎ 앞으로도 계속 응원하겠습니다‼︎