CPic,Name,Country,City,Ppic,Bias,Heart,Date,Message1,Message
https://flagcdn.com/w320/us.png,Pamela,USA,"North Carolina, USA",hjrw,"Hyeongjin, Rawhyun, Yunhyeok",#EE2424,2022-02-01,"정말 멋진 음악, 춤, 영상통화, 영상, 그리고 모든 것들까지 너무 감사해요! 저는 피크타임에서 처음 봤을 때부터 당신의 재능을 알고 있었어요. 지금까지 얼마나 멀리 왔는지 정말 자랑스러워요! 새 앨범도 정말 amazing하고, 앞으로도 더 많은 멋진 컴백을 기대할게요!!! 💖🎶🔥","Thank you so much for all the amazing music, dancing, video calls, videos, and everything! I knew you had talent when I saw you on Peak Time. I am so proud of how far you’ve come! The new album is amazing, and I look forward to many more amazing comebacks to come!!!"
https://flagcdn.com/w320/br.png,Punchyy,Brazil,"João Pessoa, Brazil",hrw,Rawhyun/Hojun,#EE2424,2024-03-01,제 하루하루를 더 행복하고 살기 좋게 만들어줘서 감사합니다 💚 여러분 한 사람 한 사람을 정말 정말 많이 사랑해요 💚,Thank you for making my days happier and better to live 💚 I love each one of you very very much 💚
https://flagcdn.com/w320/br.png,Jen,Brazil,Brazil,hrweh,"Hojun, Rawhyun & Eunho",#EE2424,2024-10-08,"저는 NTX 팬이 된 지 1년 만에 이렇게 많은 것을 목격하게 되어 정말 행복해요!! 매일매일 얼마나 성장하는지 보는 게 정말 자랑스러워요, 그리고 그 모든 걸 함께하고 싶어요. 여러분을 정말 많이 사랑해요, 곧 만나요!","I'm extremely happy to witness so much in just one year of being a fan of you guys!! I'm extremely proud to see how much you're growing every day, and I want to follow every step of that. I love you guys so much, see you soon!"
https://flagcdn.com/w320/at.png,Beca,Austria,"Salzburg, Austria",ntx1,8,#EE2424,2023-12-19,"데뷔 기념일 축하해요! 여러분에게 더 완벽한 데뷔 날짜는 없을 것 같아요. 꽃이 피고 세상이 다시 살아나는 이 시기에 매년 기념일을 맞이하는 것이 정말 여러분에게 딱 맞는 것 같아요. 여러분은 제 삶에 너무나 많은 기쁨과 아름다움을 되돌려주셨어요. 음악, 무대, 그리고 제가 볼 수 있는 여러분의 모든 모습 덕분이에요. 그 모든 것에 감사하고, 여러분 덕분에 전 세계에서 많은 귀여운 NTFUL들을 만나게 되어 너무 기뻐요. 사랑을 담아, Beca","Happy anniversary! A more perfect debut date for you guys doesn’t exist. Celebrating year after year around the days that flowers bloom and the world comes back to life is just fitting for you in my eyes. You’ve brought so so so much joy and beauty back into my life. Be it through the music, the performances or the parts of you I’m allowed to see. Thank you all for that, for everything you do and making it possible for me to meet lots and lots of cute ntfuls from all around the world. Love, Beca"
https://flagcdn.com/w320/cn.png,knt,China,中国山东青岛🇨🇳,ntx10,8,#EE2424,2025-01-01,"사랑하는 NTX 남자들, 안녕하세요! 오늘은 여러분의 데뷔 4주년입니다! 축하합니다! 🎉🎉 저는 올해 2월에 팬이 되어 여러분을 알게 되었고, 여러분의 콘텐츠도 보고 PEAKTIME도 봤어요. 정말 멋졌어요! 여러분의 노력도 봤어요 💪🏻. 여러분을 알게 되어 정말 운이 좋다고 생각해요. 이번 컴백 앨범의 모든 곡이 너무 좋습니다! 앨범이 이렇게 많이 팔린 걸 보고 정말 감동했어요 😭. 그리고 이번 컴백에서 멤버들의 의상과 조화도 정말 멋졌어요. 계속해서 포기하지 말고 나아가 주세요! 중국 NTFUL들이 여러분과 함께하며 계속해서 지원할 거예요. 우리는 여러분을 믿어요!! 꽃길만 걸으세요! 🌸 사랑해요! HAPPY NTX DAY! 🥹🫶",亲爱的NTX 男同学们 你们好 今天是你们出道的四周年！祝贺你们！🎉🎉我在今年二月刚刚入坑 开始了解你们 看你们的物料 也看了peaktime 你们好棒！我看到了你们的努力💪🏻 很幸运可以认识你们 这次回归新专的每一首都很好听！看到这次专辑大卖了这么多本我真的好感动😭而且这次回归成员们的服装 配合也都很棒～请继续坚持下去好吗！！中国NTFUL与你们同在 会继续陪伴支持你们 怀挺！！请走花路吧！🌸我爱你们 HAPPY NTX DAY！🥹🫶
https://flagcdn.com/w320/us.png,Hailey,USA,USA,ntx11,8,#EE2424,2023-12-01,"안녕하세요 NTX! 4주년 정말 축하해요! 제 삶에 이렇게 많은 행복을 선물해줘서 정말 고마워요. 춤, 노래, 그리고 그냥 미소만으로도 늘 저에게 큰 기쁨과 위로가 돼요. 매일 여러분의 노래를 듣고 있고, 항상 큰 영감을 받고 있어요. 이렇게 만날 수 있게 되어 정말 행복하고 감사해요. 정말 많이 사랑하고, 앞으로 여러분이 보여줄 멋진 모습들이 너무 기대돼요. 언제나 변함없이 응원할게요. 모든 것에 감사해요!  ","Hi NTX! I just wanted to say Happy 4th Anniversary! Thank you for giving me so much happiness in my life. Whether it's through your dancing, singing, or even just your smile, you always give me so much joy and comfort. I listen to your guy's songs every single day. You all inspire me so much and I am so glad I have been able to meet you. I love you all so much and I can't wait to see what you do in the future. I will always be supporting you guys. Thank you for everything."
https://flagcdn.com/w320/pl.png,Werka,Poland,Poland 🇵🇱,ntx12,8,#EE2424,2023-02-22,"안녕하세요, 선배님 🫡 여러분과 함께한 시간은 정말 빨리 지나갔어요. 이제 2년 넘게 팬으로 지낸 게 믿기 어려워요! 그 동안 여러분이 아티스트로 성장하는 모습을 볼 수 있어서 정말 기뻐요. 점점 더 나아지고 절대 포기하지 않는 여러분이 행복해요 🥹 여러분의 음악은 제게 정말 큰 의미가 있어요, 그리고 항상 저를 응원해 주셔서 감사합니다. 여러분은 저에게 회색이고 지루한 현실에서 벗어날 수 있는 길을 열어주셨어요 💜 앞으로 여러분이 저희를 어떤 놀라운 일로 또 한 번 놀라게 할지 정말 기대돼요! 여러분의 Vintage Girl이 💜","WASSUP SIR 🫡 The time I spent with you goes by very quickly, it's hard for me to believe that I've been your fan for over 2 years now! I'm glad that I could watch you grow as artists throughout this time. I am happy that you are getting better and better and you never give up 🥹 Your music means a lot to me and you always cheer me up, you are my escape from the gray, boring reality, for which I thank you very much 💜 I can't wait to see what else you'll surprise us with in the future! Love from your Vintage Girl 💜"
https://flagcdn.com/w320/cn.png,yg,China,China,ntx13,8,#EE2424,2023-03-01,"2023년 그 봄을 영원히 기억할 거예요! 여러분이 꿈을 향해 꾸준히 나아가는 모습을 보며 저도 힘을 얻었어요! 고마워요! 항상 사랑할게요! 힘내세요, 계속 화이팅!",永远会记得2023年的那个春天！ 看到你们对于梦想的坚持让我也有了力量！ 谢谢你们！会永远爱你们！加油加油！
https://flagcdn.com/w320/kr.png,앤사,Korea,한국,ntx14,8,#EE2424,2021-03-01,,4주년 진심으로 축하해~👏👏 NTX 덕분에 지난 4년 행복했어!! 앞으로도 더 많은 엔티플에게 사랑받는 아티스트가 될 너희를 응원할게🩷
https://flagcdn.com/w320/br.png,_https.let 💚,Brazil,"João Pessoa, Brasil",ntx15,8,#EE2424,2024-06-12,"안녕 boys, 잘 지내고 있나요?? 모든 게 잘 되기를 바래요.. 만약 그렇지 않다면, 괜찮아요, 누구나 항상 괜찮을 수는 없으니까요. 그냥 말하고 싶은 건, 저는 여러분을 사랑한다는 거예요. 단순한 방식이 아니라, 매번 불안하거나 슬플 때 여러분의 노래를 듣고, 영상을 보고, 여러분과 관련된 어떤 일을 할 때마다 말이에요. 여러분 덕분에 저는 친구도 만들고, 멋진 추억도 쌓았어요. 그리고 가장 중요한 건, 여러분 덕분에 저는 여전히 강하고 살아 있어요. 포기하지 않고 계속해서 나아가줘서 고마워요. NTFUL은 항상 여러분을 위해 있을 거예요!! 힘들 때 언제든지 우리에게 말해요. 두려워하지 말고요. 데뷔 4주년 축하해요!!! NTFUL은 여러분을 사랑해요! 💚💚","Hi boyss, how are you?? I hope everything's fine.. If it's not, well, it's okay, anyone can be fine every time. I just want to say that I love you. Not in a simple way. But in a way that every time I'm feeling anxious or sad I listen to your songs, watch your videos, or do anything related to you. Thanks to you I've made some friends and great memories. And most important, thanks to you I'm still strong and alive. Thanks for not giving up and keep going. Ntful will always be here for you!! Whenever you're feeling down tell us. Don't be scared Happy 4th anniversary!!! Ntful loves you! 💚💚"
https://flagcdn.com/w320/br.png,Iza,Brazil,"Mamanguape, Brazil 🇧🇷",ntx16,8,#EE2424,2024-06-01,"NTX, 멋진 4년간의 여정을 축하해요! 여러분의 음악과 에너지가 우리의 하루를 밝게 만들어주고, 우리는 항상 여러분을 응원할 거예요. 이 새로운 장이 더 많은 성취, 행복, 그리고 성공을 가져오기를 바라요. 전 세계 NTFUL들에게 영감을 주셔서 감사합니다! 앞으로도 함께 이 길을 걸어가요! ❤️✨ #NTX4EVER","Congratulations, NTX, on an amazing 4-year journey! Your music and energy brighten our days, and we’re always cheering for you. May this new chapter bring even more achievements, happiness, and success. Thank you for being an inspiration to all of us, NTFULs around the world! Let’s keep walking this path together! ❤️✨ #NTX4EVER"
https://flagcdn.com/w320/br.png,Diana (Didi),Brazil,Espanha (Madrid) / Brasil (João Pessoa),ntx2,8,#EE2424,2024-03-30,"NTX, 여러분은 정말 대단해요. 4년 동안 여러분의 역사에서 멈추지 않고 빛나며 세상에 여러분만의 빛을 보여줬어요. 이 특별한 빛을 절대 누군가에게 지워지지 않도록 하고, 앞으로도 많은 도시들을 방문해 주세요. 그곳에서 많은 NTFUL들의 응원을 받을 거예요. NTX, 데뷔 4주년 축하합니다!!","NTX, Vocês são incríveis, nesses 4 anos de sua história vocês não pararam de brilhar e mostrar pro mundo que voces tem luz própria, espero que vocês nunca deixem nimguem apagar esse brilho único de vocês e continuem visitando muitas cidades, onde vocês vão receber muito apoio dos e das NTFULs, parabéns NTX, Pelo seu 4 anirvesário!!"
https://flagcdn.com/w320/br.png,hyeok's guaraná,Brazil,"João Pessoa, Brasil",ntx3,8,#EE2424,2024-08-01,"저에게 NTX는 단순한 Kpop 아티스트가 아니에요... 빛과 재능으로 빛나는 그룹이에요! 여러분의 카리스마와 음악은 정말 대단하고, 여러분이 존재한다는 것에 너무 감사해요. 정말 고마워요. NTX, 화이팅! 사랑해요.","For me, NTX is more than just a kpop artist... It's a group that shines with light and talent! Your charisma and music are out of this world and I'm very grateful for your existence. Thank you so much. NTX, fighting! I love you."
https://flagcdn.com/w320/br.png,Jessica jsscgms,Brazil,"Paraíba, Brasil",ntx4,8,#EE2424,2024-04-01,"안녕, 내 사랑하는 아이들, 잘 지내고 있나요? 축하해요, 데뷔 4주년 행복해요! NTFUL로서 이 순간에 함께할 수 있어 정말 기쁘고, NTX의 번창하는 커리어를 기원해요. 저는 항상 여러분의 음악과 성취를 들으며 기쁨을 느낄 거예요. 세상 모든 사람들이 여러분을 알고 사랑하길 바래요. 모든 멤버를 똑같이 사랑한다고 꼭 알아주세요, 항상 건강하고 함께 있기를 바랍니다! 그리고 만약 어려운 일이 생기면, 언제든지 브라질의 품으로 달려와요 ❤️","Oi meus meninos, tudo bem? Parabéns, feliz 4 anos! Me sento feliz em fazer parte disso como NTFUL, desejo uma carreira próspera ao NTX estarei aqui sempre ouvindo e me alegrando com suas músicas e suas conquistas. Que o mundo inteiro os conheçam e os amem. Quero muito que saibam que eu amo TODOS os membros igualmente, fiquem sempre bem e juntos! E se as coisas ficarem difíceis, corram pros braços do Brasil ❤️"
https://flagcdn.com/w320/br.png,Viny,Brazil,itambe,ntx5,8,#EE2424,2010-03-01,"안녕하세요, 저는 브라질에서 왔어요. 사랑해요 🤗🤗 생일 축하해요! 여러분이 아주 행복하길 바랄게요. 사랑해요💕💜💜💜💌","Hi,I am from brazil,i love you🤗🤗 I wish you a happy birthday I wish you to be very happy I love you💕💜💜💜💌"
https://flagcdn.com/w320/br.png,Hana,Brazil,Brazil,ntx6,8,#EE2424,1905-07-13,"✨ NTX, 데뷔 4주년 축하해요! ✨ 네 년간의 재능, 헌신, 그리고 팬들을 향한 많은 사랑! 데뷔 이후, 여러분의 여정을 따라가는 것이 항상 특별했어요. 가까이서 여러분을 보는 것은 정말 멋졌고, 여러분이 얼마나 친절하고 재능 있는지 알게 되었어요. 이 새로운 챕터가 더 많은 성공과 잊을 수 없는 순간들, 그리고 많은 사랑을 가져다주길 바랍니다. 계속해서 빛나세요! ✨ 사랑을 담아, Hana K World","✨ Happy 4th Anniversary, NTX! ✨ Four years of talent, dedication, and so much love for the fans! Since your debut, it has always been special to follow your journey. Seeing you up close was amazing, showing how kind and talented you are. May this new chapter bring even more success, unforgettable moments, and lots of love. Keep shining! ✨ With love, Hana K World"
https://flagcdn.com/w320/id.png,Lili,Indonesia,Indonesia,ntx7,8,#EE2424,2022-09-01,"안녕하세요 NTX~ 4주년 축하해요 🥰❤️💕 여러분이 행복하고 건강하길 바래요 🤗 여러분이 여기까지 온 걸 보게 되어 자랑스러워요. 지금까지 함께할 줄은 몰랐어요, 거의 5년째 여러분과 함께하고 있어요. 우리는 많은 일을 겪었고, 즐거운 일도 있었지만 아픈 일도 있었죠. 그래서 앞으로는 우리가 함께한 즐거운 일들만 계속 이어지길 바래요. NTX가 영원히 존재하길 바랍니다. 앞으로 더 많은 사람들이 여러분을 사랑하게 되기를 바라요. NTX와 NTFUL로서 언제까지나 함께할 수 있기를 바랍니다. 사랑해요 여러분 ❤️💕","Hello NTX~ Happy 4th Anniversary 🥰❤️💕 I hope you guys happy and healthy 🤗 I'm proud to see you guys get here. I didn't expect to be with you until now, it's almost my fifth year with you. We've been through a lot, fun but also painful. So hopefully tomorrow there's only fun we've been through together forever. I wish NTX existed forever. May more people love you guys in the future. I hope we'll stick together until whenever it's as ntx and ntful. Love you guys ❤️💕"
https://flagcdn.com/w320/ca.png,Harsh,Canada,Canada,ntx8,8,#EE2424,2025-03-01,"데뷔부터 열심히 일해줘서 고마워요, 여러분의 음악을 알게 되어 정말 행복해요! 새 앨범과 이전 앨범들도 너무 좋고, 여러분은 정말 대단해요. 여러분의 보컬, 춤, 라이브 공연은 정말 에너지 넘치고 놀라워요! 모두 건강하고 행복하길 바라요 (언젠가 라이브로 여러분을 볼 수 있기를 바랍니다!). 💗♾️💗","Thank you for working so hard from debut, I'm so happy to have discovered your music! The new album and past ones are so good, you guys are amazing. Your vocals, dance, and live performances are so energetic and amazing! I hope you all stay healthy and happy (and I hope to see you live one day!). 💗♾️💗"
https://flagcdn.com/w320/jp.png,아나아나,Japan,일본,rw1,raw,#a5bd5e,,,4주년 정말 축하드려요‼︎ 언제나 멋진 무대를 보여주는 NTX가 너무 좋아요‼︎ 앞으로도 계속 응원하겠습니다‼︎
https://flagcdn.com/w320/br.png,Sarah,Brazil,"Brazil, Goiás, Goiânia",rw10,Rawhyun,#a5bd5e,2025-03-28,"NTX 모두를 정말 많이 사랑해요! 이 멋진 그룹에게 모든 좋은 일이 있기를 바래요, 6월 28일에 고이아니아에서 여러분을 볼 생각에 너무 설렙니다! 열심히 일해줘서 정말 고마워요, NTX!","NTX, i love you all very much! I wish all the best for this wonderful group and I am so excited to see you guys in june 28 in Goiânia! Thanks so much for your hard work, NTX!"
https://flagcdn.com/w320/br.png,Sarah 🐇,Brazil,João Pessoa - Brasil,rw11,Rawhyun,#a5bd5e,2024-07-01,,"모든 순간을 행복하게 해준 NTX 고마워요, 존재해줘서 고마워요, 너무 사랑해요! 여러분과 행복한 추억을 공유할 수 있어서 행복해요 ❤️"
https://flagcdn.com/w320/au.png,strawberry ! 🍓,Australia,"Sydney, Australia",rw12,Rawhyun,#a5bd5e,2021-04-01,"안녕하세요 제 NTX!!! 저는 'Full Of Lovescapes'가 발매된 직후부터 NTFUL로 활동하고 있었고, 그 이후로 여러분의 여정을 계속 지켜보고 있습니다! 항상 저에게 힘을 주고, 4년 동안 NTFUL로서 자랑스럽게 여기게 해줘서 감사합니다 🥹🩷 여러분이 성장하고 더 많은 사랑을 받는 모습을 보면서 정말 행복하고 기쁩니다! 여러분이 사랑하는 음악을 계속 만들어가세요, 그리고 NTFUL은 우리 모두의 마음을 담아 계속해서 여러분을 응원할 것입니다. 사랑해요, NTX 🫶🫶","Hello my NTX !!! I've been an NTFUL since right after Full Of Lovescapes was released, and I've been following your journey since then ! Thank you always for giving me strength and making me so proud to be an NTFUL over these 4 years 🥹🩷 Watching you grow and become more popular has made me so happy and filled me with joy ! Keep making music that you love, and NTFUL will keep following you with all of our hearts. We love you NTX 🫶🫶"
https://flagcdn.com/w320/br.png,Thay,Brazil,"Brasil, joão pessoa",rw13,Rawhyun,#a5bd5e,2024-06-01,이곳에 브라질에 대한 여러분의 애정에 감사드리기 위해 왔어요. 작년 여러분이 떠났을 때 정말 많은 그리움이 있었어요. 올해 여러분이 제 도시에서 공연을 한다고 알게 되었을 때 너무 기뻤어요. 매년 돌아와 주시기를 바래요.,"Vim aqui agradecer pelo carinho que vocês tem com o Brasil, ano passado quando vocês foram embora senti muitas saudades, este ano assim que descobri que voltariam para fazer show na minha cidade fiquei muito feliz, espero que vocês possam voltar todos os anos."
https://flagcdn.com/w320/br.png,루아,Brazil,Brazil,rw14,Rawhyun,#a5bd5e,2024-03-30,,데뷔 4주년 축하해~! 💚 오늘 난 엔티엑스와 함께 1년을 보내고 있어서 두 배로 행복해...날 너무 행복하게 해줘서 고마워 ㅠㅠ 엔티엑스 덕분에 매일 더 나은 사람이 되고 싶어!! 엔티플 된 게 제 인생에서 가장 좋은 일야...어둠 속에서도 너를 찾을 수 있어서 행복해 (⁠╥⁠﹏⁠╥⁠) 내게 가장 큰 영감을 주셔서 고마워!! 모든 멤버들이 사람으로서 아티스트로서 성장하는 모습을 보는 것을 좋아 >⁠.⁠< 덕분에 새롭고 멋진 사람들을 만날 수 있어서 정말 감사해~ 이제 더 이상 외롭지 않아ㅎㅎ 엔티엑스 노래는 나에게 위안이 됩니다...난 항상 안전하고 사랑받는다고 느낍니다~ 내가 가장 좋아하는 아티스트가 되어줘서 고마워 ♡ 좋은 추억과 미소로 우리 마음을 가득 채우자...늘 그래왔듯이 서로가 서로에게 가장 큰 힘이 되어주자~!! 앞으로도 빛나는 길을 걸어줘 ✨ 우리 영원히 함께 행복하자~ 자랑스러워!! 사랑해 💚💚
https://flagcdn.com/w320/br.png,Malu,Brazil,Brasília,rw15,Rawhyun and Xiha My UTT: Eunho,#EE2424,2024-08-01,"저는 NTX를 정말 사랑해요, 그들이 제 삶을 바꿔줬어요. 제 삶의 일부가 되어줘서 고마워요. NTFUL이 되어 정말 기뻐요. 사랑해요, NTX 💚",I love NTX so much they changed my life and I just want to thank you for being part of my life I love being NTFUL I love you NTX 💚
https://flagcdn.com/w320/jp.png,유키,Japan,JAPAN,rw16,RawHyun,#a5bd5e,2023-12-23,,피크타임으로 NTX를 알게 되었습니다. NTX의 음악을 아주 좋아합니다. 무대에서는 항상 즐겁게 해줘서 고마워요🎵4주년 축하해요🙌앞으로도 응원할게요～
https://flagcdn.com/w320/us.png,Tay (Bobaqueen),USA,"Oldsmar, FL USA",rw18,hyeok,#c24a8d,1905-07-15,"피크타임에서 보고 팬이 됐는데, 정말 열심히 하는 모습이 너무 멋있었어요! 그동안 얼마나 성장했는지 자랑스럽고, 앞으로 또 어떤 길을 걸어갈지 기대돼요! ",I became a fan after watching them on Peak Time and really admired their hard work and determination!! I'm proud to see how far they've come since then and looking forward to where they'll go next!
https://flagcdn.com/w320/br.png,Lays💖,Brazil,Brasil 🇧🇷,rw19,Rawhyun 💚,#a5bd5e,1905-07-16,"NTX, 또 다른 생일을 축하해요. 앞으로 함께할 많은 시간이 있기를 바라며, 이렇게 함께 축하할 수 있어 너무 행복해요, 여러분. 저는 브라질에서 온 NTFUL이고, 여러분 한 사람 한 사람을 사랑해요. 존재해줘서 고마워요. 💚🇧🇷","Congratulations NTX on another birthday. May many years together come and I am so happy that I can celebrate with you, boys. I am an Ntful from Brazil and I love each and every one of you, thank you for existing.💚🇧🇷"
https://flagcdn.com/w320/br.png,Têto,Brazil,João Pessoa,rw2,Raw Hyun,#a5bd5e,2024-06-01,"데뷔 하루 축하해요!!!! 여러분이 되어가는 그룹이 너무 자랑스러워요, 매번 데뷔할 때마다 서로를 뛰어넘고 있어요. 비록 멀리 있지만, 제 하루를 만들어줘서 감사하고, 앞으로도 NTX로서 함께 하는 더 많은 시간이 오기를 바래요. 정말 많이 사랑해요 <3","HAPPY DEBUT DAYYYYYYYYY!!!!! I'm very proud to see the group you guys become, with each debut you surpass each other, I'm grateful for you making my day ,even so distant, And may more years come of you together as NTX, love u guys so much <3"
https://flagcdn.com/w320/fr.png,Mayou 💗,France,France 🇫🇷,rw20,Rawhyun 💚,#a5bd5e,2024-01-01,"4주년 축하해요, 내 NTX!! 여러분이 되어온 모습이 너무 자랑스러워요, 여러분의 음악, 지속적인 행복, 그리고 웃음이 자랑스러워요. 그동안 여러분은 아름다운 사람들로 성장했어요. 항상 행복하고, 건강하며, 여러분이 누구인지, 그리고 앞으로 어떤 사람이 될지 사랑받기를 바라요 💗 자랑스러운 NTFUL로부터 사랑을 담아","Happy 4th anniversary my NTX !! I’m so proud of what you’ve become, proud of your musics, your constant happiness and your smiles, you’ve grown through all those years to become those beautiful humans being. Always be happy, be healthy and be loved for who you are and who you will be 💗 Lovely, From a proud ntful"
https://flagcdn.com/w320/my.png,Ann,Malaysia,"Kuala Lumpur, Malaysia",rw21,Rawhyun 🫶🏻 OT8,#a5bd5e,,"아이돌이 되어줘서 고마워요! 덕분에 이렇게 여러분을 만날 수 있었어요. 볼 때마다 항상 너무 행복해요! 모두 너무 대단하고, 너무 재능 있고, 정말 열심히 노력하는 모습이 정말 놀라워요. 덕분에 나 자신을 더 사랑하게 되었고, 내가 필요한 부분을 계속 개선해 나가고 싶어요. NTX를 너무, 너무 사랑해요! 데뷔 4주년 축하해요🩷 앞으로도 함께 성장하고, 오랫동안 서로 응원하면서 나아가요! 파이팅~!!","Thank you for becoming an idol! Because of you, I got to meet you all like this. I always feel so happy when I see you! Everyone is so amazing, so talented, and works so hard—it’s really incredible. Thanks to you, I’ve learned to love myself more and want to keep improving what I need to. I love NTX so, so much! Happy 4th anniversary🩷 Let’s keep growing together and cheering each other on for a long, long time! Let’s go~!!"
https://flagcdn.com/w320/br.png,sunny,Brazil,São Paulo - Brasil.,rw24,rawhyun!!!🤟🏻,#a5bd5e,2020-04-01,,그룹 4주년 축하해요!!!🇧🇷🇧🇷🤟🏻🤟🏻🤟🏻🤟🏻❤️‍🩹 4년간 정말 즐거웠던 ntx에게 감사 인사를 전하고 싶었어요!! 그들을 만난 이후로 그들 덕분에 슬픈 순간이 많이 없었습니다!!! 나는 그들을 사랑하고 앞으로 10년을 그들과 함께 보내고 싶습니다!! 브라질에서 만나요!
https://flagcdn.com/w320/br.png,Breno,Brazil,"João Pessoa, Brazil",rw3,Rawhyun,#a5bd5e,2024-04-01,"여러분이 얼마나 재능 있는지, 그리고 전 세계의 NTFUL들에게 얼마나 많은 기쁨을 주는지 꼭 알아주셨으면 해요. 계속해서 더 밝게 빛나세요, 우리는 항상 여기서 여러분의 성공을 응원하며 지켜볼 거예요. 너무 많이 사랑해요 ❤️","I just hope you all know how talented you are and how much joy you bring to us, NTFuls, all around the world. Keep shining brighter and brighter, because we'll always be here watching and rooting for your success. 너무 많이 사랑해 ❤️"
